{
	"id": "database",
	"status": "current",
	"title": "Database",
	"items": [
		{
			"id": "mysql",
			"label": "MySQL",
			"title": "",
			"separatorAfter": ", "
		},
		{
			"id": "postgresql",
			"label": "PostgreSQL",
			"title": "",
			"separatorAfter": ", "
		},
		{
			"id": "mongodb",
			"label": "MongoDB",
			"title": "",
			"separatorAfter": ", "
		},
		{
			"id": "firestore",
			"label": "Firestore",
			"title": "",
			"separatorAfter": ", "
		},
		{
			"id": "json",
			"label": "JSON",
			"title": "",
			"separatorAfter": ", "
		},
		{
			"id": "yaml",
			"label": "YAML",
			"title": "",
			"separatorAfter": "."
		}
	]
}
