{
	"id": "server-configuration-framework-ui",
	"status": "alternate",
	"title": "Server Configuration Framework UI",
	"items": [
		{
			"id": "cpanel",
			"label": "cPanel",
			"title": "",
			"separatorAfter": ", "
		},
		{
			"id": "directadmin",
			"label": "DirectAdmin",
			"title": "",
			"separatorAfter": "."
		}
	]
}
