{
	"id": "agile-methodologies",
	"status": "alternate",
	"title": "Agile Methodologies",
	"items": [
		{
			"id": "scrum",
			"label": "Scrum",
			"title": "",
			"separatorAfter": ", "
		},
		{
			"id": "kanban",
			"label": "Kanban",
			"title": "",
			"separatorAfter": ", "
		},
		{
			"id": "ddd",
			"label": "DDD",
			"title": "Domain Driven Design",
			"separatorAfter": ", "
		},
		{
			"id": "kpi",
			"label": "KPI",
			"title": "Key Performance Indicator",
			"separatorAfter": ", "
		},
		{
			"id": "okr",
			"label": "OKR",
			"title": "Objectives and Key Results",
			"separatorAfter": "."
		}
	]
}
