{
	"id": "os",
	"status": "alternate",
	"title": "OS",
	"items": [
		{
			"id": "windows",
			"label": "Windows",
			"title": "",
			"separatorAfter": ", "
		},
		{
			"id": "ubuntu",
			"label": "Ubuntu",
			"title": "",
			"separatorAfter": ", "
		},
		{
			"id": "debian",
			"label": "Debian",
			"title": "",
			"separatorAfter": ", "
		},
		{
			"id": "centos",
			"label": "CentOS",
			"title": "",
			"separatorAfter": ", "
		},
		{
			"id": "macos",
			"label": "macOS",
			"title": "",
			"separatorAfter": ", "
		},
		{
			"id": "vmware-esxi",
			"label": "VMware ESXi",
			"title": "",
			"separatorAfter": "."
		}
	]
}
