{
	"id": "build-tools",
	"status": "alternate",
	"title": "Build Tools",
	"items": [
		{
			"id": "sass",
			"label": "Sass",
			"title": "",
			"separatorAfter": ", "
		},
		{
			"id": "grunt",
			"label": "Grunt",
			"title": "",
			"separatorAfter": ", "
		},
		{
			"id": "gulp",
			"label": "Gulp",
			"title": "",
			"separatorAfter": ", "
		},
		{
			"id": "gradle",
			"label": "Gradle",
			"title": "",
			"separatorAfter": ", "
		},
		{
			"id": "webpack",
			"label": "Webpack",
			"title": "",
			"separatorAfter": "."
		}
	]
}
