{
	"id": "api",
	"status": "current",
	"title": "API",
	"items": [
		{
			"id": "soap",
			"label": "SOAP",
			"title": "",
			"separatorAfter": ", "
		},
		{
			"id": "rest",
			"label": "REST",
			"title": "",
			"separatorAfter": ", "
		},
		{
			"id": "graphql",
			"label": "GraphQL",
			"title": "",
			"separatorAfter": ", "
		},
		{
			"id": "websocket",
			"label": "WebSocket",
			"title": "",
			"separatorAfter": ", "
		},
		{
			"id": "trpc",
			"label": "tRPC",
			"title": "",
			"separatorAfter": "."
		}
	]
}
