{
	"id": "orm",
	"status": "current",
	"title": "ORM",
	"items": [
		{
			"id": "prisma",
			"label": "Prisma",
			"title": "",
			"separatorAfter": ", "
		},
		{
			"id": "typeorm",
			"label": "TypeORM",
			"title": "",
			"separatorAfter": ", "
		},
		{
			"id": "drizzle",
			"label": "Drizzle",
			"title": "",
			"separatorAfter": ", "
		},
		{
			"id": "mongoose",
			"label": "Mongoose",
			"title": "",
			"separatorAfter": "."
		}
	]
}
