{
	"id": "front-end-js-library",
	"status": "current",
	"title": "Front-end JS Library",
	"items": [
		{
			"id": "vanilla-js",
			"label": "Vanilla JS",
			"title": "",
			"separatorAfter": ", "
		},
		{
			"id": "vue-js",
			"label": "Vue.js",
			"title": "",
			"separatorAfter": ", "
		},
		{
			"id": "react-js",
			"label": "React.js",
			"title": "",
			"separatorAfter": "."
		}
	]
}
