{
	"id": "css-framework",
	"status": "current",
	"title": "CSS Framework",
	"items": [
		{
			"id": "tailwind-css",
			"label": "Tailwind CSS",
			"title": "",
			"separatorAfter": ", "
		},
		{
			"id": "shadcn",
			"label": "Shadcn",
			"title": "",
			"separatorAfter": ", "
		},
		{
			"id": "bootstrap",
			"label": "Bootstrap",
			"title": "",
			"separatorAfter": ", "
		},
		{
			"id": "material-ui",
			"label": "Material UI",
			"title": "",
			"separatorAfter": "."
		}
	]
}
