{
	"id": "core-web-essentials",
	"status": "current",
	"title": "Core Web Essentials",
	"items": [
		{
			"id": "html",
			"label": "HTML",
			"title": "",
			"separatorAfter": ", "
		},
		{
			"id": "css",
			"label": "CSS",
			"title": "",
			"separatorAfter": ", "
		},
		{
			"id": "javascript",
			"label": "JavaScript",
			"title": "",
			"separatorAfter": ", "
		},
		{
			"id": "crawl",
			"label": "Crawl",
			"title": "",
			"separatorAfter": ", "
		},
		{
			"id": "seo",
			"label": "SEO",
			"title": "",
			"separatorAfter": "."
		}
	]
}
