{
	"id": "collaboration-tool",
	"status": "alternate",
	"title": "Collaboration Tool",
	"items": [
		{
			"id": "jira",
			"label": "Jira",
			"title": "",
			"separatorAfter": ", "
		},
		{
			"id": "linear",
			"label": "Linear",
			"title": "",
			"separatorAfter": ", "
		},
		{
			"id": "trello",
			"label": "Trello",
			"title": "",
			"separatorAfter": ", "
		},
		{
			"id": "zoom",
			"label": "Zoom",
			"title": "",
			"separatorAfter": ", "
		},
		{
			"id": "slack",
			"label": "Slack",
			"title": "",
			"separatorAfter": "."
		}
	]
}
