{
	"id": "additional-programming-languages",
	"status": "alternate",
	"title": "Additional Programming Languages",
	"items": [
		{
			"id": "python",
			"label": "Python",
			"title": "",
			"separatorAfter": ", "
		},
		{
			"id": "rust",
			"label": "Rust",
			"title": "",
			"separatorAfter": ", "
		},
		{
			"id": "bash",
			"label": "Bash",
			"title": "",
			"separatorAfter": "."
		}
	]
}
